[
  {
    "name": "Fahrtkartenverkaufsstelle",
    "icon":  "ticket_shop",
    "osm_tags": {
      "shop": "ticket",
      "tickets:public_transport": "yes"
    },
    "osm_element": "Node"
  },
  {
    "name": "Informationsstelle",
    "icon":  "ticket_shop",
    "osm_tags": {
      "tourism": "information",
      "information": "office"
    },
    "osm_element": "Node"
  },
  {
    "name": "Fahrkartenautomat",
    "icon":  "ticket_shop",
    "osm_tags": {
      "amenity": "vending_machine",
      "vending": "public_transport_tickets"
    },
    "osm_element": "Node"
  },
  {
    "name": "Parkplatz",
    "icon":  "ticket_shop",
    "osm_tags": {
      "amenity": "parking",
      "access": "yes"
    },
    "osm_element": ["Node",  "ClosedWay"]
  },
  {
    "name": "Taxi-Stand",
    "icon":  "ticket_shop",
    "osm_tags": {
      "amenity": "taxi"
    },
    "osm_element": "Node"
  },
  {
    "name": "Toiletten",
    "icon":  "ticket_shop",
    "osm_tags": {
      "amenity": "toilets",
      "access": "yes"
    },
    "osm_element": "Node"
  },
  {
    "name": "Aufbewahrungsmöglichkeiten",
    "icon":  "ticket_shop",
    "osm_tags": {
      "amenity": "luggage_locker"
    },
    "osm_element": "Node"
  },
  {
    "name": "Gepäcktransport",
    "icon":  "ticket_shop",
    "osm_tags": {
      "amenity": "trolley_bay"
    },
    "osm_element": "Node"
  },
  {
    "name": "Informationssäule",
    "icon":  "ticket_shop",
    "osm_tags": {
      "tourism": "information",
      "information": "terminal"
    },
    "osm_element": "Node"
  },
  {
    "name": "Kombinierte Informations- und Notrufsäule",
    "icon":  "ticket_shop",
    "osm_tags": {
      "emergency": "phone",
      "tourism": "information",
      "information": "terminal"
    },
    "osm_element": "Node"
  },
  {
    "name": "Notrufsäule",
    "image": "ticket_shop",
    "osm_tags": {
      "emergency": "phone"
    },
    "osm_element": "Node"
  }
]